{
  "title": "Smoke",
  "subtitle": "a starter episode",
  "language": "en",
  "scenes": [
    {
      "id": "opening",
      "display": "In the beginning, a placeholder took the stage.",
      "tts": "In the beginning, a placeholder took the stage.",
      "mood": "mystic",
      "padBefore": 2,
      "padAfter": 2.4,
      "dialogue": []
    },
    {
      "id": "greeting",
      "display": "It turned, and spoke.",
      "tts": "It turned, and spoke.",
      "mood": "tender",
      "padBefore": 2,
      "padAfter": 2.4,
      "dialogue": [
        {
          "id": "greet_1",
          "characterId": "_placeholder",
          "display": "Hello, world.",
          "tts": "Hello, world."
        }
      ]
    }
  ]
}
